{
  "specVersion": 1,
  "minAppBuild": 9,
  "id": "se.varmdo.ksb",
  "municipality": {
    "name": "Värmdö kommun",
    "countryCode": "SE",
    "region": {
      "center": {
        "latitude": 59.31,
        "longitude": 18.55
      },
      "bbox": {
        "minLatitude": 59.15,
        "maxLatitude": 59.45,
        "minLongitude": 18.25,
        "maxLongitude": 19.05
      }
    },
    "geocoderNames": [
      "Värmdö",
      "Värmdö kommun"
    ]
  },
  "channel": {
    "kind": "abou",
    "baseURL": "https://service.varmdo.se",
    "service": "KSB",
    "introPath": "/KSB",
    "startPath": "/Setup.aspx?Service=KSB&skipintro=true",
    "nextEventTarget": "ctl00$ctl00$LeftAndMainSection$MainSection$ServiceSection$ServicePageNavigationSection$NextAndBackButtons$NextButton",
    "sessionLockedMarker": "Du har ett ärende igång redan",
    "completionPostBackMarker": "var doPostBack = 'True'",
    "maxCompletionPostBacks": 3,
    "pages": [
      {
        "id": "FaultReport",
        "stage": "sendingReport",
        "fields": [
          {
            "role": "category",
            "key": "KSB_14",
            "control": "dropDownListFieldControl",
            "type": "select",
            "labels": {
              "sv": [
                "Välj område",
                "Område",
                "Kategori"
              ],
              "en": [
                "Choose area",
                "Category"
              ]
            }
          },
          {
            "role": "place",
            "key": "KSB_18",
            "control": "textFieldControl",
            "type": "text",
            "labels": {
              "sv": [
                "Plats",
                "Adress",
                "Plats eller adress"
              ],
              "en": [
                "Place",
                "Location",
                "Address"
              ]
            }
          },
          {
            "role": "mapChoice",
            "key": "KSB_20",
            "control": "radioButtonListFieldControl",
            "type": "radio",
            "yesValue": "Ja, visa karta och ange position",
            "noValue": "Nej",
            "labels": {
              "sv": [
                "Jag vill också peka ut området",
                "Vill du peka ut området på karta"
              ],
              "en": [
                "I also want to mark the area"
              ]
            },
            "optionSynonyms": {
              "Ja, visa karta och ange position": [
                "Ja",
                "Ja, visa karta",
                "Visa karta"
              ],
              "Nej": [
                "Nej tack"
              ]
            }
          },
          {
            "role": "mapAnswer",
            "key": "KSB_19",
            "control": "MapAnswer",
            "type": "hidden",
            "labels": {
              "sv": [
                "Zooma och märk ut område på karta",
                "Märk ut område på karta"
              ],
              "en": [
                "Mark the area on the map"
              ]
            }
          },
          {
            "role": "description",
            "key": "U_29_1_1",
            "control": "textFieldControl",
            "type": "textarea",
            "labels": {
              "sv": [
                "Beskriv felet här",
                "Beskriv felet",
                "Beskrivning"
              ],
              "en": [
                "Describe the fault",
                "Description"
              ]
            }
          },
          {
            "role": "feedback",
            "key": "KSB_54",
            "control": "radioButtonListFieldControl",
            "type": "radio",
            "yesValue": "Ja",
            "noValue": "Nej",
            "labels": {
              "sv": [
                "Jag vill ha återkoppling",
                "Vill du ha återkoppling"
              ],
              "en": [
                "I want feedback"
              ]
            },
            "optionSynonyms": {
              "Ja": [
                "Ja tack",
                "Ja, jag vill ha återkoppling"
              ],
              "Nej": [
                "Nej tack",
                "Nej, ingen återkoppling"
              ]
            }
          }
        ]
      },
      {
        "id": "PersonalEmailInformation",
        "stage": "sendingContact",
        "fields": [
          {
            "role": "firstName",
            "key": "U_29_3_2",
            "control": "textFieldControl",
            "type": "text",
            "labels": {
              "sv": [
                "Förnamn"
              ],
              "en": [
                "First name"
              ]
            }
          },
          {
            "role": "lastName",
            "key": "U_29_3_3",
            "control": "textFieldControl",
            "type": "text",
            "labels": {
              "sv": [
                "Efternamn"
              ],
              "en": [
                "Last name"
              ]
            }
          },
          {
            "role": "phone",
            "key": "KSB_17",
            "control": "textFieldControl",
            "type": "text",
            "labels": {
              "sv": [
                "Telefon",
                "Telefonnummer",
                "Mobilnummer"
              ],
              "en": [
                "Phone"
              ]
            }
          },
          {
            "role": "email",
            "key": "U_29_3_1",
            "control": "AnswerTextBoxControl",
            "type": "text",
            "labels": {
              "sv": [
                "E-post",
                "E-postadress",
                "Epost"
              ],
              "en": [
                "Email",
                "E-mail"
              ]
            }
          }
        ]
      },
      {
        "id": "SummaryPage",
        "stage": "confirming",
        "fields": []
      }
    ],
    "upload": {
      "pageID": "FaultReport",
      "fieldID": "U.29.1.2",
      "path": "/Citizen/Field/UploadFile/U.29.1.2",
      "filePartName": "files[]",
      "fileName": "foto.jpg",
      "actionPath": "/Citizen/Field/Action"
    }
  },
  "categories": [
    {
      "id": "lighting",
      "value": "Belysning",
      "synonyms": [
        "Gatubelysning",
        "Belysning och gatlampor",
        "Gatljus"
      ],
      "title": {
        "sv": "Belysning",
        "en": "Street lighting",
        "fi": "Katuvalaistus",
        "ar": "الإنارة",
        "uk": "Освітлення",
        "pl": "Oświetlenie",
        "ru": "Уличное освещение",
        "de": "Straßenbeleuchtung",
        "fr": "Éclairage public",
        "es": "Alumbrado público",
        "it": "Illuminazione pubblica",
        "pt": "Iluminação pública",
        "nl": "Straatverlichting",
        "da": "Gadebelysning",
        "nb": "Gatelys",
        "et": "Tänavavalgustus",
        "lv": "Ielu apgaismojums",
        "lt": "Gatvių apšvietimas",
        "ro": "Iluminat stradal",
        "el": "Οδικός φωτισμός",
        "hu": "Közvilágítás",
        "cs": "Veřejné osvětlení"
      }
    },
    {
      "id": "roads",
      "value": "Gator och cykelvägar",
      "synonyms": [
        "Gator och vägar",
        "Gator, vägar och cykelvägar",
        "Gata och cykelväg",
        "Vägar"
      ],
      "title": {
        "sv": "Gator och cykelvägar",
        "en": "Streets and cycle paths",
        "fi": "Kadut ja pyörätiet",
        "ar": "الشوارع ومسارات الدراجات",
        "uk": "Вулиці та велодоріжки",
        "pl": "Ulice i drogi rowerowe",
        "ru": "Улицы и велодорожки",
        "de": "Straßen und Radwege",
        "fr": "Rues et pistes cyclables",
        "es": "Calles y carriles bici",
        "it": "Strade e piste ciclabili",
        "pt": "Ruas e ciclovias",
        "nl": "Straten en fietspaden",
        "da": "Gader og cykelstier",
        "nb": "Gater og sykkelveier",
        "et": "Tänavad ja jalgrattateed",
        "lv": "Ielas un veloceliņi",
        "lt": "Gatvės ir dviračių takai",
        "ro": "Străzi și piste de biciclete",
        "el": "Δρόμοι και ποδηλατόδρομοι",
        "hu": "Utcák és kerékpárutak",
        "cs": "Ulice a cyklostezky"
      }
    },
    {
      "id": "graffiti",
      "value": "Klotter och skadegörelse",
      "synonyms": [
        "Klotter",
        "Skadegörelse",
        "Klotter och vandalisering"
      ],
      "title": {
        "sv": "Klotter och skadegörelse",
        "en": "Graffiti and vandalism",
        "fi": "Töhryt ja ilkivalta",
        "ar": "الكتابة على الجدران والتخريب",
        "uk": "Графіті та вандалізм",
        "pl": "Graffiti i wandalizm",
        "ru": "Граффити и вандализм",
        "de": "Graffiti und Vandalismus",
        "fr": "Graffitis et vandalisme",
        "es": "Grafitis y vandalismo",
        "it": "Graffiti e vandalismo",
        "pt": "Grafitos e vandalismo",
        "nl": "Graffiti en vandalisme",
        "da": "Graffiti og hærværk",
        "nb": "Graffiti og hærverk",
        "et": "Grafiti ja vandalism",
        "lv": "Grafiti un vandālisms",
        "lt": "Grafičiai ir vandalizmas",
        "ro": "Graffiti și vandalism",
        "el": "Γκράφιτι και βανδαλισμοί",
        "hu": "Graffiti és rongálás",
        "cs": "Graffiti a vandalismus"
      }
    },
    {
      "id": "parks",
      "value": "Parker och grönytor",
      "synonyms": [
        "Parker och grönområden",
        "Park och natur",
        "Parker, lekplatser och grönytor",
        "Grönytor"
      ],
      "title": {
        "sv": "Parker och grönytor",
        "en": "Parks and green spaces",
        "fi": "Puistot ja viheralueet",
        "ar": "الحدائق والمساحات الخضراء",
        "uk": "Парки та зелені зони",
        "pl": "Parki i tereny zielone",
        "ru": "Парки и зелёные зоны",
        "de": "Parks und Grünflächen",
        "fr": "Parcs et espaces verts",
        "es": "Parques y zonas verdes",